{"batch_number":21,"batch_size":100,"cases":[{"classification":{"confidence":null,"domain":null,"eligible":null,"notes":"","quality_flags":[],"risk":null,"script":null},"id":"zhtw-project-balanced-baseline-guard-v1/formal-001","input":"委员会将在下周公布会议记录。","provenance":{"raw_url":"benchmarks/accuracy/sources/zhtw-project-balanced-baseline-guard-v1.json","source_case_id":"formal-001","split":"project_original"},"source_id":"zhtw-project-balanced-baseline-guard-v1"},{"classification":{"confidence":null,"domain":null,"eligible":null,"notes":"","quality_flags":[],"risk":null,"script":null},"id":"zhtw-project-balanced-baseline-guard-v1/formal-002","input":"主办单位已完成活动场地的确认工作。","provenance":{"raw_url":"benchmarks/accuracy/sources/zhtw-project-balanced-baseline-guard-v1.json","source_case_id":"formal-002","split":"project_original"},"source_id":"zhtw-project-balanced-baseline-guard-v1"},{"classification":{"confidence":null,"domain":null,"eligible":null,"notes":"","quality_flags":[],"risk":null,"script":null},"id":"zhtw-project-balanced-baseline-guard-v1/formal-003","input":"报告依照章节顺序说明调查过程。","provenance":{"raw_url":"benchmarks/accuracy/sources/zhtw-project-balanced-baseline-guard-v1.json","source_case_id":"formal-003","split":"project_original"},"source_id":"zhtw-project-balanced-baseline-guard-v1"},{"classification":{"confidence":null,"domain":null,"eligible":null,"notes":"","quality_flags":[],"risk":null,"script":null},"id":"zhtw-project-balanced-baseline-guard-v1/formal-004","input":"各部门应在期限内提交执行成果。","provenance":{"raw_url":"benchmarks/accuracy/sources/zhtw-project-balanced-baseline-guard-v1.json","source_case_id":"formal-004","split":"project_original"},"source_id":"zhtw-project-balanced-baseline-guard-v1"},{"classification":{"confidence":null,"domain":null,"eligible":null,"notes":"","quality_flags":[],"risk":null,"script":null},"id":"zhtw-project-balanced-baseline-guard-v1/formal-005","input":"本次会议讨论了年度工作安排。","provenance":{"raw_url":"benchmarks/accuracy/sources/zhtw-project-balanced-baseline-guard-v1.json","source_case_id":"formal-005","split":"project_original"},"source_id":"zhtw-project-balanced-baseline-guard-v1"},{"classification":{"confidence":null,"domain":null,"eligible":null,"notes":"","quality_flags":[],"risk":null,"script":null},"id":"zhtw-project-balanced-baseline-guard-v1/formal-006","input":"承办人员将汇整意见并更新文件。","provenance":{"raw_url":"benchmarks/accuracy/sources/zhtw-project-balanced-baseline-guard-v1.json","source_case_id":"formal-006","split":"project_original"},"source_id":"zhtw-project-balanced-baseline-guard-v1"},{"classification":{"confidence":null,"domain":null,"eligible":null,"notes":"","quality_flags":[],"risk":null,"script":null},"id":"zhtw-project-balanced-baseline-guard-v1/formal-007","input":"修订内容自公告之日起开始实施。","provenance":{"raw_url":"benchmarks/accuracy/sources/zhtw-project-balanced-baseline-guard-v1.json","source_case_id":"formal-007","split":"project_original"},"source_id":"zhtw-project-balanced-baseline-guard-v1"},{"classification":{"confidence":null,"domain":null,"eligible":null,"notes":"","quality_flags":[],"risk":null,"script":null},"id":"zhtw-project-balanced-baseline-guard-v1/formal-008","input":"附件列出各项任务的完成日期。","provenance":{"raw_url":"benchmarks/accuracy/sources/zhtw-project-balanced-baseline-guard-v1.json","source_case_id":"formal-008","split":"project_original"},"source_id":"zhtw-project-balanced-baseline-guard-v1"},{"classification":{"confidence":null,"domain":null,"eligible":null,"notes":"","quality_flags":[],"risk":null,"script":null},"id":"zhtw-project-balanced-baseline-guard-v1/formal-009","input":"申请资料不完整者将收到补件通知。","provenance":{"raw_url":"benchmarks/accuracy/sources/zhtw-project-balanced-baseline-guard-v1.json","source_case_id":"formal-009","split":"project_original"},"source_id":"zhtw-project-balanced-baseline-guard-v1"},{"classification":{"confidence":null,"domain":null,"eligible":null,"notes":"","quality_flags":[],"risk":null,"script":null},"id":"zhtw-project-balanced-baseline-guard-v1/formal-010","input":"审核结果预计在月底前寄出。","provenance":{"raw_url":"benchmarks/accuracy/sources/zhtw-project-balanced-baseline-guard-v1.json","source_case_id":"formal-010","split":"project_original"},"source_id":"zhtw-project-balanced-baseline-guard-v1"},{"classification":{"confidence":null,"domain":null,"eligible":null,"notes":"","quality_flags":[],"risk":null,"script":null},"id":"zhtw-project-balanced-baseline-guard-v1/formal-011","input":"负责人已说明计划调整的主要原因。","provenance":{"raw_url":"benchmarks/accuracy/sources/zhtw-project-balanced-baseline-guard-v1.json","source_case_id":"formal-011","split":"project_original"},"source_id":"zhtw-project-balanced-baseline-guard-v1"},{"classification":{"confidence":null,"domain":null,"eligible":null,"notes":"","quality_flags":[],"risk":null,"script":null},"id":"zhtw-project-balanced-baseline-guard-v1/formal-012","input":"新闻稿介绍新服务的适用对象。","provenance":{"raw_url":"benchmarks/accuracy/sources/zhtw-project-balanced-baseline-guard-v1.json","source_case_id":"formal-012","split":"project_original"},"source_id":"zhtw-project-balanced-baseline-guard-v1"},{"classification":{"confidence":null,"domain":null,"eligible":null,"notes":"","quality_flags":[],"risk":null,"script":null},"id":"zhtw-project-balanced-baseline-guard-v1/formal-013","input":"调查结果显示参与人数持续增加。","provenance":{"raw_url":"benchmarks/accuracy/sources/zhtw-project-balanced-baseline-guard-v1.json","source_case_id":"formal-013","split":"project_original"},"source_id":"zhtw-project-balanced-baseline-guard-v1"},{"classification":{"confidence":null,"domain":null,"eligible":null,"notes":"","quality_flags":[],"risk":null,"script":null},"id":"zhtw-project-balanced-baseline-guard-v1/formal-014","input":"工作小组将定期检查办理进度。","provenance":{"raw_url":"benchmarks/accuracy/sources/zhtw-project-balanced-baseline-guard-v1.json","source_case_id":"formal-014","split":"project_original"},"source_id":"zhtw-project-balanced-baseline-guard-v1"},{"classification":{"confidence":null,"domain":null,"eligible":null,"notes":"","quality_flags":[],"risk":null,"script":null},"id":"zhtw-project-balanced-baseline-guard-v1/formal-015","input":"会议结论由秘书处统一整理。","provenance":{"raw_url":"benchmarks/accuracy/sources/zhtw-project-balanced-baseline-guard-v1.json","source_case_id":"formal-015","split":"project_original"},"source_id":"zhtw-project-balanced-baseline-guard-v1"},{"classification":{"confidence":null,"domain":null,"eligible":null,"notes":"","quality_flags":[],"risk":null,"script":null},"id":"zhtw-project-balanced-baseline-guard-v1/formal-016","input":"文件编号 DOC-2026-041 应列在首页右上角。","provenance":{"raw_url":"benchmarks/accuracy/sources/zhtw-project-balanced-baseline-guard-v1.json","source_case_id":"formal-016","split":"project_original"},"source_id":"zhtw-project-balanced-baseline-guard-v1"},{"classification":{"confidence":null,"domain":null,"eligible":null,"notes":"","quality_flags":[],"risk":null,"script":null},"id":"zhtw-project-balanced-baseline-guard-v1/formal-017","input":"附件名称 Appendix C 保留英文格式。","provenance":{"raw_url":"benchmarks/accuracy/sources/zhtw-project-balanced-baseline-guard-v1.json","source_case_id":"formal-017","split":"project_original"},"source_id":"zhtw-project-balanced-baseline-guard-v1"},{"classification":{"confidence":null,"domain":null,"eligible":null,"notes":"","quality_flags":[],"risk":null,"script":null},"id":"zhtw-project-balanced-baseline-guard-v1/formal-018","input":"表格中的项目代码 A-104 不得变更。","provenance":{"raw_url":"benchmarks/accuracy/sources/zhtw-project-balanced-baseline-guard-v1.json","source_case_id":"formal-018","split":"project_original"},"source_id":"zhtw-project-balanced-baseline-guard-v1"},{"classification":{"confidence":null,"domain":null,"eligible":null,"notes":"","quality_flags":[],"risk":null,"script":null},"id":"zhtw-project-balanced-baseline-guard-v1/formal-019","input":"公文引用 ISO 8601 时保留标准编号。","provenance":{"raw_url":"benchmarks/accuracy/sources/zhtw-project-balanced-baseline-guard-v1.json","source_case_id":"formal-019","split":"project_original"},"source_id":"zhtw-project-balanced-baseline-guard-v1"},{"classification":{"confidence":null,"domain":null,"eligible":null,"notes":"","quality_flags":[],"risk":null,"script":null},"id":"zhtw-project-balanced-baseline-guard-v1/formal-020","input":"会议记录中的网址 https://example.org/report 保持不变。","provenance":{"raw_url":"benchmarks/accuracy/sources/zhtw-project-balanced-baseline-guard-v1.json","source_case_id":"formal-020","split":"project_original"},"source_id":"zhtw-project-balanced-baseline-guard-v1"},{"classification":{"confidence":null,"domain":null,"eligible":null,"notes":"","quality_flags":[],"risk":null,"script":null},"id":"zhtw-project-balanced-baseline-guard-v1/formal-021","input":"报告标题沿用“Project North Star”正式名称。","provenance":{"raw_url":"benchmarks/accuracy/sources/zhtw-project-balanced-baseline-guard-v1.json","source_case_id":"formal-021","split":"project_original"},"source_id":"zhtw-project-balanced-baseline-guard-v1"},{"classification":{"confidence":null,"domain":null,"eligible":null,"notes":"","quality_flags":[],"risk":null,"script":null},"id":"zhtw-project-balanced-baseline-guard-v1/formal-022","input":"统计表以 FY2026 表示本财政年度。","provenance":{"raw_url":"benchmarks/accuracy/sources/zhtw-project-balanced-baseline-guard-v1.json","source_case_id":"formal-022","split":"project_original"},"source_id":"zhtw-project-balanced-baseline-guard-v1"},{"classification":{"confidence":null,"domain":null,"eligible":null,"notes":"","quality_flags":[],"risk":null,"script":null},"id":"zhtw-project-balanced-baseline-guard-v1/formal-023","input":"公告中的联系信箱 service@example.org 不应改写。","provenance":{"raw_url":"benchmarks/accuracy/sources/zhtw-project-balanced-baseline-guard-v1.json","source_case_id":"formal-023","split":"project_original"},"source_id":"zhtw-project-balanced-baseline-guard-v1"},{"classification":{"confidence":null,"domain":null,"eligible":null,"notes":"","quality_flags":[],"risk":null,"script":null},"id":"zhtw-project-balanced-baseline-guard-v1/formal-024","input":"决议编号 RES-18